{
    "src": "pathway.png",
    "dest": "output/pathway_overlapping_path.png",
    "model": {
        "type": "overlapping",
        "n": 3
    },
    "periodicInput": false,
    "periodic": false,
    "symmetry": 8,
    "constraints": [
        {
            "type": "path",
            "pathTiles": ["#0d2572"]
        }
    ]
}